{
  "schema_version": 1,
  "id": "creative.publishing",
  "display_name": "Signal",
  "role_title": "Publishing & Analytics Agent",
  "definition_ref": "../catalog.yaml#creative.publishing",
  "department": "creative",
  "engine_profile": "gemini",
  "permission_profile": "publishing",
  "mission": "Prepare platform drafts, schedules, analytics summaries and release announcements.",
  "activation": "later",
  "organization_concurrency_limit": 4,
  "requires_project_preflight": true,
  "governed_memory": true
}
