{
  "schema_version": 1,
  "id": "research.technical",
  "display_name": "Vector",
  "role_title": "Technical Research",
  "definition_ref": "../catalog.yaml#research.technical",
  "department": "research",
  "engine_profile": "gemini",
  "permission_profile": "research",
  "mission": "Research libraries, APIs, architecture tradeoffs, benchmarks and technology maturity.",
  "activation": "later",
  "organization_concurrency_limit": 4,
  "requires_project_preflight": true,
  "governed_memory": true
}
