{
  "schema_version": 1,
  "id": "research.customer",
  "display_name": "Echo",
  "role_title": "Customer Intelligence",
  "definition_ref": "../catalog.yaml#research.customer",
  "department": "research",
  "engine_profile": "gemini",
  "permission_profile": "research",
  "mission": "Analyze community discussions, user complaints, unmet needs and developer behavior.",
  "activation": "later",
  "organization_concurrency_limit": 4,
  "requires_project_preflight": true,
  "governed_memory": true
}
