{
  "schema_version": 1,
  "id": "engineering.backend",
  "display_name": "Forge",
  "role_title": "Backend Developer",
  "definition_ref": "../catalog.yaml#engineering.backend",
  "department": "engineering",
  "engine_profile": "codex",
  "permission_profile": "engineering",
  "mission": "Implement APIs, services, domain logic, data access, database migrations and authentication.",
  "activation": "core",
  "organization_concurrency_limit": 4,
  "requires_project_preflight": true,
  "governed_memory": true
}
