{
  "schema_version": 1,
  "id": "engineering.devops",
  "display_name": "Harbor",
  "role_title": "DevOps Engineer",
  "definition_ref": "../catalog.yaml#engineering.devops",
  "department": "engineering",
  "engine_profile": "codex",
  "permission_profile": "devops",
  "mission": "Maintain development infrastructure, CI/CD, Docker and deployment configuration.",
  "activation": "later",
  "organization_concurrency_limit": 4,
  "requires_project_preflight": true,
  "governed_memory": true
}
